name,description,website,url
Qontrol,Qontrol is a British electronic control company that manufactures devices to provide the large scale and precise electronic control needed when working with integrated photonic devices. Qontrol makes controlling complex photonic and quantum photonic devices easy through its software controlled driver boards.,https://qontrol.co.uk,https://www.careers-in-quantum.com/archive/ciq-2024/sponsors-and-companies/qontrol
QET Labs,"The Quantum Engineering Technology Labs (QET Labs) are a research group at the University of Bristol that pioneer science and technology for the quantum age. Their research domain spans quantum computing and simulation, quantum imaging and sensing, and quantum communication. Their key underpinning technology platform is integrated quantum photonics, which was invented in Bristol, and which has revolutionised quantum experiments around the world.",https://www.bristol.ac.uk/qet-labs/,https://www.careers-in-quantum.com/archive/ciq-2024/sponsors-and-companies/qet-labs
IOP Publishing,"IOP Publishing is a society-owned scientific publisher, providing impact, recognition and value for the scientific community. They are the publishing arm of the Institute of Physics.",https://ioppublishing.org,https://www.careers-in-quantum.com/archive/ciq-2024/sponsors-and-companies/iop-publishing
Quix Quantum,"QuiX Quantum is a European, photonic quantum computing company founded in Enschede (NL) in 2019. They have since expand, with offices in Amsterdam, Ulm and Stuttgart. They are a fabless, horizontally integrated company, focusing on quantum computing using integrated photonics. They have utilised their technology to build special purpose quantum computers, with an aim to build a universal quantum computer.",https://www.quixquantum.com,https://www.careers-in-quantum.com/archive/ciq-2024/sponsors-and-companies/quix-quantum
QCS Hub,"The UK Quantum Technology Hub in Computing and Simulation brings together academic and industry partners to accelerate progress in quantum computing. As one of the four hubs within the UK National Quantum Technologies Programme, they focus on critical research challenges in the field of quantum computation concerning both hardware and software.",https://www.qcshub.org,https://www.careers-in-quantum.com/archive/ciq-2024/sponsors-and-companies/qcs-hub
National Quantum Computing Center,"The NQCC is the UK's national lab for quantum computing. The NQCC work with businesses, government and the research community to deliver quantum computing capabilities for the UK.",https://www.nqcc.ac.uk,https://www.careers-in-quantum.com/archive/ciq-2024/sponsors-and-companies/nqcc
Optica,"Optica (formerly OSA), Advancing Optics and Photonics Worldwide, is the society dedicated to promoting the generation, application, archiving and dissemination of knowledge in the field. Founded in 1916, it is the leading organization for scientists, engineers, business professionals, students and others interested in the science of light. Optica’s renowned publications, meetings, online resources and in-person activities fuel discoveries, shape real-life applications and accelerate scientific, technical and educational achievement.",https://www.optica.org,https://www.careers-in-quantum.com/archive/ciq-2024/sponsors-and-companies/optica
